{
  "meta": {
    "weekLabel": "2026-W20",
    "generatedAt": "2026-05-16T01:38:31.849200+00:00",
    "modelVersion": "rf-v2.1",
    "featureVersion": "v2.1-28f",
    "overallConfidence": "MEDIUM",
    "dataSourceStatus": {
      "cot": "OK",
      "macro": "OK",
      "cross_asset": "OK",
      "calendar": "OK"
    },
    "pipelineRuntime": 2.67
  },
  "predictions": [
    {
      "currency": "AUD",
      "bias": "NEUTRAL",
      "probability": {
        "bull": 0.4244,
        "neutral": 0.5699,
        "bear": 0.0056
      },
      "confidence": "MEDIUM",
      "rank": 1,
      "key_drivers": [
        "CPI differential",
        "COT positioning",
        "Leveraged funds"
      ],
      "alerts": [
        "EXTREME_POSITIONING"
      ]
    },
    {
      "currency": "USD",
      "bias": "NEUTRAL",
      "probability": {
        "bull": 0.0669,
        "neutral": 0.8158,
        "bear": 0.1173
      },
      "confidence": "HIGH",
      "rank": 2,
      "key_drivers": [
        "Net position change",
        "COT positioning",
        "COT 4w momentum"
      ],
      "alerts": []
    },
    {
      "currency": "CAD",
      "bias": "NEUTRAL",
      "probability": {
        "bull": 0.4369,
        "neutral": 0.5576,
        "bear": 0.0055
      },
      "confidence": "MEDIUM",
      "rank": 3,
      "key_drivers": [
        "CPI differential",
        "COT positioning",
        "Net position change"
      ],
      "alerts": []
    },
    {
      "currency": "CHF",
      "bias": "NEUTRAL",
      "probability": {
        "bull": 0.416,
        "neutral": 0.5766,
        "bear": 0.0073
      },
      "confidence": "MEDIUM",
      "rank": 4,
      "key_drivers": [
        "CPI differential",
        "Dealer contrarian",
        "Leveraged funds"
      ],
      "alerts": []
    },
    {
      "currency": "EUR",
      "bias": "NEUTRAL",
      "probability": {
        "bull": 0.0703,
        "neutral": 0.8135,
        "bear": 0.1162
      },
      "confidence": "HIGH",
      "rank": 5,
      "key_drivers": [
        "CPI differential",
        "Spread vs USD",
        "Leveraged funds"
      ],
      "alerts": []
    },
    {
      "currency": "GBP",
      "bias": "NEUTRAL",
      "probability": {
        "bull": 0.0566,
        "neutral": 0.7993,
        "bear": 0.144
      },
      "confidence": "HIGH",
      "rank": 6,
      "key_drivers": [
        "CPI differential",
        "Leveraged funds",
        "Spread vs USD"
      ],
      "alerts": []
    },
    {
      "currency": "JPY",
      "bias": "NEUTRAL",
      "probability": {
        "bull": 0.4344,
        "neutral": 0.5596,
        "bear": 0.0059
      },
      "confidence": "MEDIUM",
      "rank": 7,
      "key_drivers": [
        "CPI differential",
        "Spread vs USD",
        "Momentum acceleration"
      ],
      "alerts": []
    },
    {
      "currency": "NZD",
      "bias": "NEUTRAL",
      "probability": {
        "bull": 0.0611,
        "neutral": 0.8019,
        "bear": 0.137
      },
      "confidence": "HIGH",
      "rank": 8,
      "key_drivers": [
        "CPI differential",
        "Dealer contrarian",
        "Spread vs USD"
      ],
      "alerts": []
    }
  ],
  "pair_recommendations": {
    "strong_long": [],
    "strong_short": [],
    "avoid": [
      {
        "pair": "AUD/USD",
        "spread": 0.0,
        "base_currency": "AUD",
        "quote_currency": "USD",
        "confidence": "MEDIUM"
      },
      {
        "pair": "AUD/CAD",
        "spread": 0.0,
        "base_currency": "AUD",
        "quote_currency": "CAD",
        "confidence": "MEDIUM"
      },
      {
        "pair": "AUD/CHF",
        "spread": 0.0,
        "base_currency": "AUD",
        "quote_currency": "CHF",
        "confidence": "MEDIUM"
      }
    ]
  },
  "weekly_alerts": [
    {
      "type": "EXTREME_POSITIONING",
      "currency": "AUD",
      "message": "AUD COT index in extreme zone (98.4)",
      "severity": "MEDIUM",
      "context": {
        "cot_index": 98.44
      }
    }
  ]
}