{
  "meta": {
    "weekLabel": "2026-W29",
    "generatedAt": "2026-07-18T03:53:49.159274+00:00",
    "modelVersion": "rf-v2.1",
    "featureVersion": "v2.1-28f",
    "overallConfidence": "MEDIUM",
    "dataSourceStatus": {
      "cot": "OK",
      "macro": "OK",
      "cross_asset": "OK",
      "calendar": "OK"
    },
    "pipelineRuntime": 3.12
  },
  "predictions": [
    {
      "currency": "USD",
      "bias": "NEUTRAL",
      "probability": {
        "bull": 0.4254,
        "neutral": 0.5649,
        "bear": 0.0097
      },
      "confidence": "MEDIUM",
      "rank": 1,
      "key_drivers": [
        "COT positioning",
        "COT 4w momentum",
        "Dealer contrarian"
      ],
      "alerts": [
        "EXTREME_POSITIONING"
      ]
    },
    {
      "currency": "AUD",
      "bias": "NEUTRAL",
      "probability": {
        "bull": 0.0841,
        "neutral": 0.7642,
        "bear": 0.1517
      },
      "confidence": "HIGH",
      "rank": 2,
      "key_drivers": [
        "CPI differential",
        "Leveraged funds",
        "Spread vs USD"
      ],
      "alerts": []
    },
    {
      "currency": "CHF",
      "bias": "NEUTRAL",
      "probability": {
        "bull": 0.4711,
        "neutral": 0.5195,
        "bear": 0.0094
      },
      "confidence": "LOW",
      "rank": 3,
      "key_drivers": [
        "CPI differential",
        "Spread vs USD",
        "Dealer contrarian"
      ],
      "alerts": []
    },
    {
      "currency": "GBP",
      "bias": "NEUTRAL",
      "probability": {
        "bull": 0.4292,
        "neutral": 0.5598,
        "bear": 0.011
      },
      "confidence": "MEDIUM",
      "rank": 4,
      "key_drivers": [
        "CPI differential",
        "Spread vs USD",
        "Leveraged funds"
      ],
      "alerts": []
    },
    {
      "currency": "JPY",
      "bias": "NEUTRAL",
      "probability": {
        "bull": 0.447,
        "neutral": 0.5434,
        "bear": 0.0095
      },
      "confidence": "LOW",
      "rank": 5,
      "key_drivers": [
        "CPI differential",
        "Spread vs USD",
        "Momentum acceleration"
      ],
      "alerts": []
    },
    {
      "currency": "EUR",
      "bias": "NEUTRAL",
      "probability": {
        "bull": 0.0651,
        "neutral": 0.7485,
        "bear": 0.1864
      },
      "confidence": "HIGH",
      "rank": 6,
      "key_drivers": [
        "Net position change",
        "CPI differential",
        "Spread vs USD"
      ],
      "alerts": [
        "EXTREME_POSITIONING",
        "FLIP_DETECTED"
      ]
    },
    {
      "currency": "CAD",
      "bias": "NEUTRAL",
      "probability": {
        "bull": 0.0629,
        "neutral": 0.7376,
        "bear": 0.1995
      },
      "confidence": "HIGH",
      "rank": 7,
      "key_drivers": [
        "CPI differential",
        "Spread vs USD",
        "Dealer contrarian"
      ],
      "alerts": [
        "EXTREME_POSITIONING"
      ]
    },
    {
      "currency": "NZD",
      "bias": "NEUTRAL",
      "probability": {
        "bull": 0.0723,
        "neutral": 0.7627,
        "bear": 0.165
      },
      "confidence": "HIGH",
      "rank": 8,
      "key_drivers": [
        "CPI differential",
        "Spread vs USD",
        "COT 4w momentum"
      ],
      "alerts": [
        "EXTREME_POSITIONING"
      ]
    }
  ],
  "pair_recommendations": {
    "strong_long": [],
    "strong_short": [],
    "avoid": [
      {
        "pair": "AUD/USD",
        "spread": 0.0,
        "base_currency": "AUD",
        "quote_currency": "USD",
        "confidence": "HIGH"
      },
      {
        "pair": "AUD/CHF",
        "spread": 0.0,
        "base_currency": "AUD",
        "quote_currency": "CHF",
        "confidence": "MEDIUM"
      },
      {
        "pair": "AUD/GBP",
        "spread": 0.0,
        "base_currency": "AUD",
        "quote_currency": "GBP",
        "confidence": "HIGH"
      }
    ]
  },
  "weekly_alerts": [
    {
      "type": "EXTREME_POSITIONING",
      "currency": "CAD",
      "message": "CAD COT index in extreme zone (0.0)",
      "severity": "MEDIUM",
      "context": {
        "cot_index": 0.0
      }
    },
    {
      "type": "EXTREME_POSITIONING",
      "currency": "EUR",
      "message": "EUR COT index in extreme zone (0.0)",
      "severity": "MEDIUM",
      "context": {
        "cot_index": 0.0
      }
    },
    {
      "type": "FLIP_DETECTED",
      "currency": "EUR",
      "message": "EUR net position flipped direction this week",
      "severity": "MEDIUM"
    },
    {
      "type": "EXTREME_POSITIONING",
      "currency": "NZD",
      "message": "NZD COT index in extreme zone (0.0)",
      "severity": "MEDIUM",
      "context": {
        "cot_index": 0.0
      }
    },
    {
      "type": "EXTREME_POSITIONING",
      "currency": "USD",
      "message": "USD COT index in extreme zone (100.0)",
      "severity": "MEDIUM",
      "context": {
        "cot_index": 100.0
      }
    }
  ]
}