{
  "meta": {
    "weekLabel": "2026-W24",
    "generatedAt": "2026-06-13T01:47:22.748116+00:00",
    "modelVersion": "rf-v2.1",
    "featureVersion": "v2.1-28f",
    "overallConfidence": "MEDIUM",
    "dataSourceStatus": {
      "cot": "OK",
      "macro": "OK",
      "cross_asset": "OK",
      "calendar": "OK"
    },
    "pipelineRuntime": 3.2
  },
  "predictions": [
    {
      "currency": "USD",
      "bias": "NEUTRAL",
      "probability": {
        "bull": 0.4417,
        "neutral": 0.5529,
        "bear": 0.0054
      },
      "confidence": "MEDIUM",
      "rank": 1,
      "key_drivers": [
        "Net position change",
        "COT positioning",
        "COT 4w momentum"
      ],
      "alerts": [
        "EXTREME_POSITIONING",
        "FLIP_DETECTED"
      ]
    },
    {
      "currency": "AUD",
      "bias": "NEUTRAL",
      "probability": {
        "bull": 0.0609,
        "neutral": 0.8206,
        "bear": 0.1185
      },
      "confidence": "HIGH",
      "rank": 2,
      "key_drivers": [
        "CPI differential",
        "COT 4w momentum",
        "COT positioning"
      ],
      "alerts": []
    },
    {
      "currency": "CHF",
      "bias": "NEUTRAL",
      "probability": {
        "bull": 0.4558,
        "neutral": 0.5387,
        "bear": 0.0055
      },
      "confidence": "LOW",
      "rank": 3,
      "key_drivers": [
        "CPI differential",
        "Dealer contrarian",
        "COT positioning"
      ],
      "alerts": []
    },
    {
      "currency": "NZD",
      "bias": "NEUTRAL",
      "probability": {
        "bull": 0.4391,
        "neutral": 0.5552,
        "bear": 0.0057
      },
      "confidence": "MEDIUM",
      "rank": 4,
      "key_drivers": [
        "CPI differential",
        "COT 4w momentum",
        "COT positioning"
      ],
      "alerts": []
    },
    {
      "currency": "CAD",
      "bias": "NEUTRAL",
      "probability": {
        "bull": 0.0565,
        "neutral": 0.8103,
        "bear": 0.1332
      },
      "confidence": "HIGH",
      "rank": 5,
      "key_drivers": [
        "CPI differential",
        "COT 4w momentum",
        "Spread vs USD"
      ],
      "alerts": []
    },
    {
      "currency": "EUR",
      "bias": "NEUTRAL",
      "probability": {
        "bull": 0.4244,
        "neutral": 0.5698,
        "bear": 0.0058
      },
      "confidence": "MEDIUM",
      "rank": 6,
      "key_drivers": [
        "CPI differential",
        "Net position change",
        "Spread vs USD"
      ],
      "alerts": []
    },
    {
      "currency": "GBP",
      "bias": "NEUTRAL",
      "probability": {
        "bull": 0.412,
        "neutral": 0.5817,
        "bear": 0.0063
      },
      "confidence": "MEDIUM",
      "rank": 7,
      "key_drivers": [
        "CPI differential",
        "Spread vs USD",
        "Leveraged funds"
      ],
      "alerts": []
    },
    {
      "currency": "JPY",
      "bias": "NEUTRAL",
      "probability": {
        "bull": 0.0466,
        "neutral": 0.8126,
        "bear": 0.1407
      },
      "confidence": "HIGH",
      "rank": 8,
      "key_drivers": [
        "CPI differential",
        "COT 4w momentum",
        "Spread vs USD"
      ],
      "alerts": [
        "EXTREME_POSITIONING"
      ]
    }
  ],
  "pair_recommendations": {
    "strong_long": [],
    "strong_short": [],
    "avoid": [
      {
        "pair": "AUD/USD",
        "spread": 0.0,
        "base_currency": "AUD",
        "quote_currency": "USD",
        "confidence": "HIGH"
      },
      {
        "pair": "AUD/CHF",
        "spread": 0.0,
        "base_currency": "AUD",
        "quote_currency": "CHF",
        "confidence": "MEDIUM"
      },
      {
        "pair": "AUD/CAD",
        "spread": 0.0,
        "base_currency": "AUD",
        "quote_currency": "CAD",
        "confidence": "HIGH"
      }
    ]
  },
  "weekly_alerts": [
    {
      "type": "EXTREME_POSITIONING",
      "currency": "JPY",
      "message": "JPY COT index in extreme zone (0.0)",
      "severity": "MEDIUM",
      "context": {
        "cot_index": 0.0
      }
    },
    {
      "type": "EXTREME_POSITIONING",
      "currency": "USD",
      "message": "USD COT index in extreme zone (92.0)",
      "severity": "MEDIUM",
      "context": {
        "cot_index": 91.98
      }
    },
    {
      "type": "FLIP_DETECTED",
      "currency": "USD",
      "message": "USD net position flipped direction this week",
      "severity": "MEDIUM"
    }
  ]
}