{
  "meta": {
    "weekLabel": "2026-W12",
    "generatedAt": "2026-03-22T08:15:00Z",
    "modelVersion": "v1.3.2",
    "featureVersion": "v1.2.0",
    "overallConfidence": "HIGH",
    "dataSourceStatus": {
      "cot": "OK",
      "macro": "OK",
      "cross_asset": "OK",
      "calendar": "FALLBACK"
    },
    "pipelineRuntime": 312
  },
  "predictions": [
    {
      "currency": "USD",
      "bias": "BULL",
      "probability": { "bull": 0.72, "neutral": 0.18, "bear": 0.10 },
      "confidence": "HIGH",
      "rank": 1,
      "key_drivers": ["Strong NFP beat", "Fed hawkish pivot signal", "DXY momentum"],
      "alerts": [],
      "historical_accuracy_12w": 0.83
    },
    {
      "currency": "JPY",
      "bias": "BEAR",
      "probability": { "bull": 0.09, "neutral": 0.17, "bear": 0.74 },
      "confidence": "HIGH",
      "rank": 8,
      "key_drivers": ["BOJ dovish hold", "Yield differential extreme", "Weak CPI"],
      "alerts": ["EXTREME_POSITIONING"],
      "historical_accuracy_12w": 0.79
    },
    {
      "currency": "EUR",
      "bias": "BEAR",
      "probability": { "bull": 0.18, "neutral": 0.25, "bear": 0.57 },
      "confidence": "MEDIUM",
      "rank": 7,
      "key_drivers": ["ECB rate cut expectation", "Germany PMI miss", "COT net short"],
      "alerts": ["MACRO_COT_CONFLICT"],
      "historical_accuracy_12w": 0.71
    },
    {
      "currency": "GBP",
      "bias": "BULL",
      "probability": { "bull": 0.61, "neutral": 0.24, "bear": 0.15 },
      "confidence": "MEDIUM",
      "rank": 2,
      "key_drivers": ["BOE hawkish hold", "CPI sticky above target", "COT flip bullish"],
      "alerts": [],
      "historical_accuracy_12w": 0.68
    },
    {
      "currency": "AUD",
      "bias": "NEUTRAL",
      "probability": { "bull": 0.36, "neutral": 0.38, "bear": 0.26 },
      "confidence": "LOW",
      "rank": 5,
      "key_drivers": ["RBA data-dependent", "China PMI mixed", "Commodity flat"],
      "alerts": ["LOW_CONFIDENCE"],
      "historical_accuracy_12w": 0.63
    },
    {
      "currency": "CAD",
      "bias": "BEAR",
      "probability": { "bull": 0.14, "neutral": 0.22, "bear": 0.64 },
      "confidence": "MEDIUM",
      "rank": 6,
      "key_drivers": ["BOC rate cut expected", "Oil decline", "Weak capex"],
      "alerts": [],
      "historical_accuracy_12w": 0.72
    },
    {
      "currency": "CHF",
      "bias": "NEUTRAL",
      "probability": { "bull": 0.28, "neutral": 0.44, "bear": 0.28 },
      "confidence": "LOW",
      "rank": 4,
      "key_drivers": ["SNB intervention risk", "Tight range", "Low vol regime"],
      "alerts": [],
      "historical_accuracy_12w": 0.58
    },
    {
      "currency": "NZD",
      "bias": "BULL",
      "probability": { "bull": 0.55, "neutral": 0.28, "bear": 0.17 },
      "confidence": "MEDIUM",
      "rank": 3,
      "key_drivers": ["RBNZ hold hawkish", "COT flip long", "Dairy prices up"],
      "alerts": [],
      "historical_accuracy_12w": 0.67
    }
  ],
  "pair_recommendations": {
    "strong_long": [
      { "pair": "USD/JPY", "spread": 0.65, "base_currency": "USD", "quote_currency": "JPY", "confidence": "HIGH" },
      { "pair": "GBP/CAD", "spread": 1.2, "base_currency": "GBP", "quote_currency": "CAD", "confidence": "MEDIUM" },
      { "pair": "NZD/EUR", "spread": 0.9, "base_currency": "NZD", "quote_currency": "EUR", "confidence": "MEDIUM" }
    ],
    "strong_short": [
      { "pair": "EUR/USD", "spread": 0.5, "base_currency": "EUR", "quote_currency": "USD", "confidence": "MEDIUM" },
      { "pair": "CAD/JPY", "spread": 0.8, "base_currency": "CAD", "quote_currency": "JPY", "confidence": "MEDIUM" },
      { "pair": "EUR/GBP", "spread": 0.7, "base_currency": "EUR", "quote_currency": "GBP", "confidence": "MEDIUM" }
    ],
    "avoid": [
      { "pair": "AUD/CHF", "spread": 1.5, "base_currency": "AUD", "quote_currency": "CHF", "confidence": "LOW" },
      { "pair": "CHF/NZD", "spread": 1.8, "base_currency": "CHF", "quote_currency": "NZD", "confidence": "LOW" }
    ]
  },
  "weekly_alerts": [
    {
      "type": "EXTREME_POSITIONING",
      "currency": "JPY",
      "message": "Non-commercial net short JPY at 52-week extreme (-89.2k contracts). Mean-reversion risk elevated.",
      "severity": "HIGH",
      "context": { "cot_index": 4, "net_contracts": -89200 }
    },
    {
      "type": "CALENDAR_SOURCE_FALLBACK",
      "message": "Calendar data fell back to cached version (12h old). FOMC minutes release time unconfirmed.",
      "severity": "MEDIUM",
      "context": { "cached_age_hours": 12 }
    },
    {
      "type": "MACRO_COT_CONFLICT",
      "currency": "EUR",
      "message": "EUR COT net long but macro model signals bearish. Divergence exceeds 2.0σ threshold.",
      "severity": "MEDIUM",
      "context": { "cot_net": 12500, "macro_score": -0.62, "divergence_sigma": 2.3 }
    }
  ]
}
