{
  "meta": {
    "weekLabel": "2026-W28",
    "generatedAt": "2026-07-11T04:11:45.264702+00:00",
    "modelVersion": "rf-v2.1",
    "featureVersion": "v2.1-28f",
    "overallConfidence": "MEDIUM",
    "dataSourceStatus": {
      "cot": "OK",
      "macro": "OK",
      "cross_asset": "OK",
      "calendar": "OK"
    },
    "pipelineRuntime": 2.67
  },
  "predictions": [
    {
      "currency": "USD",
      "bias": "NEUTRAL",
      "probability": {
        "bull": 0.4121,
        "neutral": 0.5773,
        "bear": 0.0106
      },
      "confidence": "MEDIUM",
      "rank": 1,
      "key_drivers": [
        "COT positioning",
        "COT 4w momentum",
        "Leveraged funds"
      ],
      "alerts": [
        "EXTREME_POSITIONING"
      ]
    },
    {
      "currency": "AUD",
      "bias": "NEUTRAL",
      "probability": {
        "bull": 0.0861,
        "neutral": 0.7696,
        "bear": 0.1443
      },
      "confidence": "HIGH",
      "rank": 2,
      "key_drivers": [
        "CPI differential",
        "Leveraged funds",
        "COT 4w momentum"
      ],
      "alerts": []
    },
    {
      "currency": "CHF",
      "bias": "NEUTRAL",
      "probability": {
        "bull": 0.475,
        "neutral": 0.5153,
        "bear": 0.0096
      },
      "confidence": "LOW",
      "rank": 3,
      "key_drivers": [
        "CPI differential",
        "Spread vs USD",
        "COT 4w momentum"
      ],
      "alerts": []
    },
    {
      "currency": "EUR",
      "bias": "NEUTRAL",
      "probability": {
        "bull": 0.0853,
        "neutral": 0.7644,
        "bear": 0.1502
      },
      "confidence": "HIGH",
      "rank": 4,
      "key_drivers": [
        "CPI differential",
        "COT 4w momentum",
        "Net position change"
      ],
      "alerts": [
        "EXTREME_POSITIONING"
      ]
    },
    {
      "currency": "CAD",
      "bias": "NEUTRAL",
      "probability": {
        "bull": 0.0861,
        "neutral": 0.7493,
        "bear": 0.1647
      },
      "confidence": "HIGH",
      "rank": 5,
      "key_drivers": [
        "CPI differential",
        "Spread vs USD",
        "Dealer contrarian"
      ],
      "alerts": [
        "EXTREME_POSITIONING"
      ]
    },
    {
      "currency": "GBP",
      "bias": "NEUTRAL",
      "probability": {
        "bull": 0.422,
        "neutral": 0.5665,
        "bear": 0.0115
      },
      "confidence": "MEDIUM",
      "rank": 6,
      "key_drivers": [
        "CPI differential",
        "Spread vs USD",
        "COT 4w momentum"
      ],
      "alerts": [
        "EXTREME_POSITIONING"
      ]
    },
    {
      "currency": "JPY",
      "bias": "NEUTRAL",
      "probability": {
        "bull": 0.0673,
        "neutral": 0.746,
        "bear": 0.1868
      },
      "confidence": "HIGH",
      "rank": 7,
      "key_drivers": [
        "CPI differential",
        "Spread vs USD",
        "Gold COT"
      ],
      "alerts": [
        "EXTREME_POSITIONING"
      ]
    },
    {
      "currency": "NZD",
      "bias": "NEUTRAL",
      "probability": {
        "bull": 0.074,
        "neutral": 0.7589,
        "bear": 0.1671
      },
      "confidence": "HIGH",
      "rank": 8,
      "key_drivers": [
        "CPI differential",
        "COT 4w momentum",
        "Spread vs USD"
      ],
      "alerts": [
        "EXTREME_POSITIONING"
      ]
    }
  ],
  "pair_recommendations": {
    "strong_long": [],
    "strong_short": [],
    "avoid": [
      {
        "pair": "AUD/USD",
        "spread": 0.0,
        "base_currency": "AUD",
        "quote_currency": "USD",
        "confidence": "HIGH"
      },
      {
        "pair": "AUD/CHF",
        "spread": 0.0,
        "base_currency": "AUD",
        "quote_currency": "CHF",
        "confidence": "MEDIUM"
      },
      {
        "pair": "AUD/EUR",
        "spread": 0.0,
        "base_currency": "AUD",
        "quote_currency": "EUR",
        "confidence": "HIGH"
      }
    ]
  },
  "weekly_alerts": [
    {
      "type": "EXTREME_POSITIONING",
      "currency": "CAD",
      "message": "CAD COT index in extreme zone (4.5)",
      "severity": "MEDIUM",
      "context": {
        "cot_index": 4.45
      }
    },
    {
      "type": "EXTREME_POSITIONING",
      "currency": "EUR",
      "message": "EUR COT index in extreme zone (4.6)",
      "severity": "MEDIUM",
      "context": {
        "cot_index": 4.6
      }
    },
    {
      "type": "EXTREME_POSITIONING",
      "currency": "GBP",
      "message": "GBP COT index in extreme zone (2.6)",
      "severity": "MEDIUM",
      "context": {
        "cot_index": 2.57
      }
    },
    {
      "type": "EXTREME_POSITIONING",
      "currency": "JPY",
      "message": "JPY COT index in extreme zone (0.0)",
      "severity": "MEDIUM",
      "context": {
        "cot_index": 0.0
      }
    },
    {
      "type": "EXTREME_POSITIONING",
      "currency": "NZD",
      "message": "NZD COT index in extreme zone (0.0)",
      "severity": "MEDIUM",
      "context": {
        "cot_index": 0.0
      }
    },
    {
      "type": "EXTREME_POSITIONING",
      "currency": "USD",
      "message": "USD COT index in extreme zone (99.4)",
      "severity": "MEDIUM",
      "context": {
        "cot_index": 99.39
      }
    }
  ]
}