{
  "meta": {
    "weekLabel": "2026-W31",
    "generatedAt": "2026-08-01T04:19:49.238800+00:00",
    "modelVersion": "rf-v2.1",
    "featureVersion": "v2.1-28f",
    "overallConfidence": "MEDIUM",
    "dataSourceStatus": {
      "cot": "OK",
      "macro": "OK",
      "cross_asset": "OK",
      "calendar": "OK"
    },
    "pipelineRuntime": 2.89
  },
  "predictions": [
    {
      "currency": "USD",
      "bias": "NEUTRAL",
      "probability": {
        "bull": 0.4381,
        "neutral": 0.5529,
        "bear": 0.0091
      },
      "confidence": "MEDIUM",
      "rank": 1,
      "key_drivers": [
        "COT positioning",
        "Leveraged funds",
        "Dealer contrarian"
      ],
      "alerts": [
        "EXTREME_POSITIONING"
      ]
    },
    {
      "currency": "GBP",
      "bias": "NEUTRAL",
      "probability": {
        "bull": 0.4094,
        "neutral": 0.5801,
        "bear": 0.0105
      },
      "confidence": "MEDIUM",
      "rank": 2,
      "key_drivers": [
        "CPI differential",
        "COT 4w momentum",
        "Leveraged funds"
      ],
      "alerts": []
    },
    {
      "currency": "CHF",
      "bias": "NEUTRAL",
      "probability": {
        "bull": 0.4722,
        "neutral": 0.5191,
        "bear": 0.0087
      },
      "confidence": "LOW",
      "rank": 3,
      "key_drivers": [
        "CPI differential",
        "COT 4w momentum",
        "Dealer contrarian"
      ],
      "alerts": []
    },
    {
      "currency": "AUD",
      "bias": "NEUTRAL",
      "probability": {
        "bull": 0.0856,
        "neutral": 0.7651,
        "bear": 0.1493
      },
      "confidence": "HIGH",
      "rank": 4,
      "key_drivers": [
        "CPI differential",
        "Spread vs USD",
        "Leveraged funds"
      ],
      "alerts": []
    },
    {
      "currency": "NZD",
      "bias": "NEUTRAL",
      "probability": {
        "bull": 0.4685,
        "neutral": 0.5231,
        "bear": 0.0084
      },
      "confidence": "LOW",
      "rank": 5,
      "key_drivers": [
        "CPI differential",
        "Spread vs USD",
        "Dealer contrarian"
      ],
      "alerts": []
    },
    {
      "currency": "JPY",
      "bias": "NEUTRAL",
      "probability": {
        "bull": 0.0845,
        "neutral": 0.7489,
        "bear": 0.1666
      },
      "confidence": "HIGH",
      "rank": 6,
      "key_drivers": [
        "CPI differential",
        "Spread vs USD",
        "Momentum acceleration"
      ],
      "alerts": [
        "EXTREME_POSITIONING"
      ]
    },
    {
      "currency": "CAD",
      "bias": "NEUTRAL",
      "probability": {
        "bull": 0.4146,
        "neutral": 0.5735,
        "bear": 0.0118
      },
      "confidence": "MEDIUM",
      "rank": 7,
      "key_drivers": [
        "CPI differential",
        "Spread vs USD",
        "Dealer contrarian"
      ],
      "alerts": [
        "EXTREME_POSITIONING"
      ]
    },
    {
      "currency": "EUR",
      "bias": "NEUTRAL",
      "probability": {
        "bull": 0.0655,
        "neutral": 0.7536,
        "bear": 0.1809
      },
      "confidence": "HIGH",
      "rank": 8,
      "key_drivers": [
        "CPI differential",
        "Net position change",
        "Spread vs USD"
      ],
      "alerts": [
        "EXTREME_POSITIONING"
      ]
    }
  ],
  "pair_recommendations": {
    "strong_long": [],
    "strong_short": [],
    "avoid": [
      {
        "pair": "GBP/USD",
        "spread": 0.0,
        "base_currency": "GBP",
        "quote_currency": "USD",
        "confidence": "MEDIUM"
      },
      {
        "pair": "GBP/AUD",
        "spread": 0.0,
        "base_currency": "GBP",
        "quote_currency": "AUD",
        "confidence": "MEDIUM"
      },
      {
        "pair": "GBP/NZD",
        "spread": 0.0,
        "base_currency": "GBP",
        "quote_currency": "NZD",
        "confidence": "MEDIUM"
      }
    ]
  },
  "weekly_alerts": [
    {
      "type": "EXTREME_POSITIONING",
      "currency": "CAD",
      "message": "CAD COT index in extreme zone (0.9)",
      "severity": "MEDIUM",
      "context": {
        "cot_index": 0.86
      }
    },
    {
      "type": "EXTREME_POSITIONING",
      "currency": "EUR",
      "message": "EUR COT index in extreme zone (0.0)",
      "severity": "MEDIUM",
      "context": {
        "cot_index": 0.0
      }
    },
    {
      "type": "EXTREME_POSITIONING",
      "currency": "JPY",
      "message": "JPY COT index in extreme zone (1.2)",
      "severity": "MEDIUM",
      "context": {
        "cot_index": 1.2
      }
    },
    {
      "type": "EXTREME_POSITIONING",
      "currency": "USD",
      "message": "USD COT index in extreme zone (100.0)",
      "severity": "MEDIUM",
      "context": {
        "cot_index": 100.0
      }
    }
  ]
}