{
  "meta": {
    "weekLabel": "2026-W12",
    "generatedAt": "2026-03-20T17:15:00.948738+00:00",
    "modelVersion": "rf-v2.1",
    "featureVersion": "v2.1-28f",
    "overallConfidence": "MEDIUM",
    "dataSourceStatus": {
      "cot": "OK",
      "macro": "OK",
      "cross_asset": "OK",
      "calendar": "OK"
    },
    "pipelineRuntime": 3.18
  },
  "predictions": [
    {
      "currency": "CAD",
      "bias": "NEUTRAL",
      "probability": {
        "bull": 0.4284,
        "neutral": 0.561,
        "bear": 0.0106
      },
      "confidence": "MEDIUM",
      "rank": 1,
      "key_drivers": [
        "CPI differential",
        "COT positioning",
        "Net position change"
      ],
      "alerts": [
        "EXTREME_POSITIONING"
      ]
    },
    {
      "currency": "AUD",
      "bias": "NEUTRAL",
      "probability": {
        "bull": 0.0742,
        "neutral": 0.7129,
        "bear": 0.2128
      },
      "confidence": "HIGH",
      "rank": 2,
      "key_drivers": [
        "CPI differential",
        "COT positioning",
        "Leveraged funds"
      ],
      "alerts": [
        "EXTREME_POSITIONING"
      ]
    },
    {
      "currency": "USD",
      "bias": "NEUTRAL",
      "probability": {
        "bull": 0.0813,
        "neutral": 0.7482,
        "bear": 0.1705
      },
      "confidence": "HIGH",
      "rank": 3,
      "key_drivers": [
        "COT 4w momentum",
        "COT positioning",
        "Momentum acceleration"
      ],
      "alerts": []
    },
    {
      "currency": "EUR",
      "bias": "NEUTRAL",
      "probability": {
        "bull": 0.0754,
        "neutral": 0.7396,
        "bear": 0.185
      },
      "confidence": "HIGH",
      "rank": 4,
      "key_drivers": [
        "CPI differential",
        "COT 4w momentum",
        "Leveraged funds"
      ],
      "alerts": []
    },
    {
      "currency": "NZD",
      "bias": "NEUTRAL",
      "probability": {
        "bull": 0.0733,
        "neutral": 0.703,
        "bear": 0.2237
      },
      "confidence": "HIGH",
      "rank": 5,
      "key_drivers": [
        "CPI differential",
        "Dealer contrarian",
        "Leveraged funds"
      ],
      "alerts": []
    },
    {
      "currency": "CHF",
      "bias": "NEUTRAL",
      "probability": {
        "bull": 0.4721,
        "neutral": 0.5183,
        "bear": 0.0096
      },
      "confidence": "LOW",
      "rank": 6,
      "key_drivers": [
        "CPI differential",
        "Leveraged funds",
        "Dealer contrarian"
      ],
      "alerts": []
    },
    {
      "currency": "GBP",
      "bias": "NEUTRAL",
      "probability": {
        "bull": 0.078,
        "neutral": 0.733,
        "bear": 0.189
      },
      "confidence": "HIGH",
      "rank": 7,
      "key_drivers": [
        "CPI differential",
        "COT 4w momentum",
        "Leveraged funds"
      ],
      "alerts": [
        "EXTREME_POSITIONING"
      ]
    },
    {
      "currency": "JPY",
      "bias": "NEUTRAL",
      "probability": {
        "bull": 0.0728,
        "neutral": 0.7199,
        "bear": 0.2072
      },
      "confidence": "HIGH",
      "rank": 8,
      "key_drivers": [
        "CPI differential",
        "Net position change",
        "Spread vs USD"
      ],
      "alerts": [
        "EXTREME_POSITIONING",
        "FLIP_DETECTED"
      ]
    }
  ],
  "pair_recommendations": {
    "strong_long": [],
    "strong_short": [],
    "avoid": [
      {
        "pair": "CAD/AUD",
        "spread": 0.0,
        "base_currency": "CAD",
        "quote_currency": "AUD",
        "confidence": "MEDIUM"
      },
      {
        "pair": "CAD/USD",
        "spread": 0.0,
        "base_currency": "CAD",
        "quote_currency": "USD",
        "confidence": "MEDIUM"
      },
      {
        "pair": "CAD/EUR",
        "spread": 0.0,
        "base_currency": "CAD",
        "quote_currency": "EUR",
        "confidence": "MEDIUM"
      }
    ]
  },
  "weekly_alerts": [
    {
      "type": "EXTREME_POSITIONING",
      "currency": "AUD",
      "message": "AUD COT index in extreme zone (91.9)",
      "severity": "MEDIUM",
      "context": {
        "cot_index": 91.94
      }
    },
    {
      "type": "EXTREME_POSITIONING",
      "currency": "CAD",
      "message": "CAD COT index in extreme zone (100.0)",
      "severity": "MEDIUM",
      "context": {
        "cot_index": 100.0
      }
    },
    {
      "type": "EXTREME_POSITIONING",
      "currency": "GBP",
      "message": "GBP COT index in extreme zone (6.2)",
      "severity": "MEDIUM",
      "context": {
        "cot_index": 6.23
      }
    },
    {
      "type": "EXTREME_POSITIONING",
      "currency": "JPY",
      "message": "JPY COT index in extreme zone (1.7)",
      "severity": "MEDIUM",
      "context": {
        "cot_index": 1.68
      }
    },
    {
      "type": "FLIP_DETECTED",
      "currency": "JPY",
      "message": "JPY net position flipped direction this week",
      "severity": "MEDIUM"
    }
  ]
}