{
  "meta": {
    "weekLabel": "2026-W13",
    "generatedAt": "2026-03-28T01:37:13.191662+00:00",
    "modelVersion": "rf-v2.1",
    "featureVersion": "v2.1-28f",
    "overallConfidence": "MEDIUM",
    "dataSourceStatus": {
      "cot": "OK",
      "macro": "OK",
      "cross_asset": "OK",
      "calendar": "OK"
    },
    "pipelineRuntime": 3.18
  },
  "predictions": [
    {
      "currency": "AUD",
      "bias": "NEUTRAL",
      "probability": {
        "bull": 0.4293,
        "neutral": 0.5655,
        "bear": 0.0052
      },
      "confidence": "MEDIUM",
      "rank": 1,
      "key_drivers": [
        "CPI differential",
        "COT positioning",
        "Leveraged funds"
      ],
      "alerts": [
        "EXTREME_POSITIONING"
      ]
    },
    {
      "currency": "USD",
      "bias": "NEUTRAL",
      "probability": {
        "bull": 0.4775,
        "neutral": 0.5177,
        "bear": 0.0048
      },
      "confidence": "LOW",
      "rank": 2,
      "key_drivers": [
        "Net position change",
        "Momentum acceleration",
        "COT positioning"
      ],
      "alerts": [
        "FLIP_DETECTED"
      ]
    },
    {
      "currency": "CAD",
      "bias": "NEUTRAL",
      "probability": {
        "bull": 0.064,
        "neutral": 0.8086,
        "bear": 0.1274
      },
      "confidence": "HIGH",
      "rank": 3,
      "key_drivers": [
        "CPI differential",
        "Net position change",
        "COT positioning"
      ],
      "alerts": []
    },
    {
      "currency": "CHF",
      "bias": "NEUTRAL",
      "probability": {
        "bull": 0.4703,
        "neutral": 0.5245,
        "bear": 0.0051
      },
      "confidence": "LOW",
      "rank": 4,
      "key_drivers": [
        "CPI differential",
        "Momentum acceleration",
        "COT 4w momentum"
      ],
      "alerts": []
    },
    {
      "currency": "NZD",
      "bias": "NEUTRAL",
      "probability": {
        "bull": 0.4607,
        "neutral": 0.5341,
        "bear": 0.0053
      },
      "confidence": "LOW",
      "rank": 5,
      "key_drivers": [
        "CPI differential",
        "Momentum acceleration",
        "Dealer contrarian"
      ],
      "alerts": []
    },
    {
      "currency": "GBP",
      "bias": "NEUTRAL",
      "probability": {
        "bull": 0.4308,
        "neutral": 0.5623,
        "bear": 0.0069
      },
      "confidence": "MEDIUM",
      "rank": 6,
      "key_drivers": [
        "CPI differential",
        "Spread vs USD",
        "Leveraged funds"
      ],
      "alerts": []
    },
    {
      "currency": "EUR",
      "bias": "NEUTRAL",
      "probability": {
        "bull": 0.0527,
        "neutral": 0.8174,
        "bear": 0.1298
      },
      "confidence": "HIGH",
      "rank": 7,
      "key_drivers": [
        "CPI differential",
        "COT 4w momentum",
        "Spread vs USD"
      ],
      "alerts": [
        "EXTREME_POSITIONING"
      ]
    },
    {
      "currency": "JPY",
      "bias": "NEUTRAL",
      "probability": {
        "bull": 0.0496,
        "neutral": 0.8137,
        "bear": 0.1367
      },
      "confidence": "HIGH",
      "rank": 8,
      "key_drivers": [
        "CPI differential",
        "COT 4w momentum",
        "Spread vs USD"
      ],
      "alerts": [
        "EXTREME_POSITIONING"
      ]
    }
  ],
  "pair_recommendations": {
    "strong_long": [],
    "strong_short": [],
    "avoid": [
      {
        "pair": "AUD/USD",
        "spread": 0.0,
        "base_currency": "AUD",
        "quote_currency": "USD",
        "confidence": "MEDIUM"
      },
      {
        "pair": "AUD/CAD",
        "spread": 0.0,
        "base_currency": "AUD",
        "quote_currency": "CAD",
        "confidence": "MEDIUM"
      },
      {
        "pair": "AUD/CHF",
        "spread": 0.0,
        "base_currency": "AUD",
        "quote_currency": "CHF",
        "confidence": "MEDIUM"
      }
    ]
  },
  "weekly_alerts": [
    {
      "type": "RISK_OFF_REGIME",
      "message": "VIX elevated at 27.4 \u2014 risk-off regime active",
      "severity": "HIGH",
      "context": {
        "vix": 27.44
      }
    },
    {
      "type": "EXTREME_POSITIONING",
      "currency": "AUD",
      "message": "AUD COT index in extreme zone (100.0)",
      "severity": "MEDIUM",
      "context": {
        "cot_index": 100.0
      }
    },
    {
      "type": "EXTREME_POSITIONING",
      "currency": "EUR",
      "message": "EUR COT index in extreme zone (0.0)",
      "severity": "MEDIUM",
      "context": {
        "cot_index": 0.0
      }
    },
    {
      "type": "EXTREME_POSITIONING",
      "currency": "JPY",
      "message": "JPY COT index in extreme zone (0.0)",
      "severity": "MEDIUM",
      "context": {
        "cot_index": 0.0
      }
    },
    {
      "type": "FLIP_DETECTED",
      "currency": "USD",
      "message": "USD net position flipped direction this week",
      "severity": "MEDIUM"
    }
  ]
}