{
  "meta": {
    "weekLabel": "2026-W21",
    "generatedAt": "2026-05-23T01:39:18.778810+00:00",
    "modelVersion": "rf-v2.1",
    "featureVersion": "v2.1-28f",
    "overallConfidence": "MEDIUM",
    "dataSourceStatus": {
      "cot": "OK",
      "macro": "OK",
      "cross_asset": "OK",
      "calendar": "OK"
    },
    "pipelineRuntime": 2.34
  },
  "predictions": [
    {
      "currency": "AUD",
      "bias": "NEUTRAL",
      "probability": {
        "bull": 0.4024,
        "neutral": 0.5919,
        "bear": 0.0057
      },
      "confidence": "MEDIUM",
      "rank": 1,
      "key_drivers": [
        "CPI differential",
        "COT positioning",
        "Leveraged funds"
      ],
      "alerts": [
        "EXTREME_POSITIONING"
      ]
    },
    {
      "currency": "USD",
      "bias": "NEUTRAL",
      "probability": {
        "bull": 0.438,
        "neutral": 0.5555,
        "bear": 0.0064
      },
      "confidence": "MEDIUM",
      "rank": 2,
      "key_drivers": [
        "Net position change",
        "COT positioning",
        "Momentum acceleration"
      ],
      "alerts": []
    },
    {
      "currency": "CAD",
      "bias": "NEUTRAL",
      "probability": {
        "bull": 0.07,
        "neutral": 0.8197,
        "bear": 0.1103
      },
      "confidence": "HIGH",
      "rank": 3,
      "key_drivers": [
        "CPI differential",
        "COT positioning",
        "COT 4w momentum"
      ],
      "alerts": []
    },
    {
      "currency": "GBP",
      "bias": "NEUTRAL",
      "probability": {
        "bull": 0.4252,
        "neutral": 0.5688,
        "bear": 0.006
      },
      "confidence": "MEDIUM",
      "rank": 4,
      "key_drivers": [
        "CPI differential",
        "Leveraged funds",
        "Momentum acceleration"
      ],
      "alerts": []
    },
    {
      "currency": "CHF",
      "bias": "NEUTRAL",
      "probability": {
        "bull": 0.0612,
        "neutral": 0.7986,
        "bear": 0.1402
      },
      "confidence": "HIGH",
      "rank": 5,
      "key_drivers": [
        "CPI differential",
        "Dealer contrarian",
        "Spread vs USD"
      ],
      "alerts": []
    },
    {
      "currency": "NZD",
      "bias": "NEUTRAL",
      "probability": {
        "bull": 0.4584,
        "neutral": 0.5362,
        "bear": 0.0054
      },
      "confidence": "LOW",
      "rank": 6,
      "key_drivers": [
        "CPI differential",
        "Dealer contrarian",
        "Spread vs USD"
      ],
      "alerts": []
    },
    {
      "currency": "EUR",
      "bias": "NEUTRAL",
      "probability": {
        "bull": 0.4225,
        "neutral": 0.5715,
        "bear": 0.006
      },
      "confidence": "MEDIUM",
      "rank": 7,
      "key_drivers": [
        "CPI differential",
        "Spread vs USD",
        "Leveraged funds"
      ],
      "alerts": []
    },
    {
      "currency": "JPY",
      "bias": "NEUTRAL",
      "probability": {
        "bull": 0.0657,
        "neutral": 0.8008,
        "bear": 0.1335
      },
      "confidence": "HIGH",
      "rank": 8,
      "key_drivers": [
        "CPI differential",
        "Spread vs USD",
        "Momentum acceleration"
      ],
      "alerts": []
    }
  ],
  "pair_recommendations": {
    "strong_long": [],
    "strong_short": [],
    "avoid": [
      {
        "pair": "AUD/USD",
        "spread": 0.0,
        "base_currency": "AUD",
        "quote_currency": "USD",
        "confidence": "MEDIUM"
      },
      {
        "pair": "AUD/CAD",
        "spread": 0.0,
        "base_currency": "AUD",
        "quote_currency": "CAD",
        "confidence": "MEDIUM"
      },
      {
        "pair": "AUD/GBP",
        "spread": 0.0,
        "base_currency": "AUD",
        "quote_currency": "GBP",
        "confidence": "MEDIUM"
      }
    ]
  },
  "weekly_alerts": [
    {
      "type": "EXTREME_POSITIONING",
      "currency": "AUD",
      "message": "AUD COT index in extreme zone (100.0)",
      "severity": "MEDIUM",
      "context": {
        "cot_index": 100.0
      }
    }
  ]
}