{
  "meta": {
    "weekLabel": "2026-W10",
    "generatedAt": "2026-03-08T08:05:00Z",
    "modelVersion": "v1.3.1",
    "featureVersion": "v1.2.0",
    "overallConfidence": "MEDIUM",
    "dataSourceStatus": {
      "cot": "OK",
      "macro": "STALE",
      "cross_asset": "OK",
      "calendar": "OK"
    },
    "pipelineRuntime": 310
  },
  "predictions": [
    { "currency": "USD", "bias": "BULL", "probability": { "bull": 0.64, "neutral": 0.22, "bear": 0.14 }, "confidence": "MEDIUM", "rank": 1, "key_drivers": ["Fed hawkish hold", "CPI inline"], "alerts": [], "historical_accuracy_12w": 0.81 },
    { "currency": "JPY", "bias": "BEAR", "probability": { "bull": 0.13, "neutral": 0.20, "bear": 0.67 }, "confidence": "HIGH", "rank": 8, "key_drivers": ["BOJ ultra-dovish", "Rate gap wide"], "alerts": ["EXTREME_POSITIONING"], "historical_accuracy_12w": 0.78 },
    { "currency": "EUR", "bias": "NEUTRAL", "probability": { "bull": 0.30, "neutral": 0.38, "bear": 0.32 }, "confidence": "LOW", "rank": 5, "key_drivers": ["ECB mixed signals", "Data ambiguous"], "alerts": ["LOW_CONFIDENCE"], "historical_accuracy_12w": 0.69 },
    { "currency": "GBP", "bias": "BULL", "probability": { "bull": 0.55, "neutral": 0.27, "bear": 0.18 }, "confidence": "MEDIUM", "rank": 2, "key_drivers": ["UK services CPI hot", "COT net long"], "alerts": [], "historical_accuracy_12w": 0.66 },
    { "currency": "AUD", "bias": "BEAR", "probability": { "bull": 0.22, "neutral": 0.28, "bear": 0.50 }, "confidence": "MEDIUM", "rank": 7, "key_drivers": ["RBA cut signal", "China PMI soft"], "alerts": [], "historical_accuracy_12w": 0.61 },
    { "currency": "CAD", "bias": "BEAR", "probability": { "bull": 0.18, "neutral": 0.26, "bear": 0.56 }, "confidence": "MEDIUM", "rank": 6, "key_drivers": ["Oil bearish", "BOC cut"], "alerts": [], "historical_accuracy_12w": 0.70 },
    { "currency": "CHF", "bias": "BULL", "probability": { "bull": 0.52, "neutral": 0.30, "bear": 0.18 }, "confidence": "MEDIUM", "rank": 3, "key_drivers": ["Safe haven demand", "SNB hold"], "alerts": [], "historical_accuracy_12w": 0.60 },
    { "currency": "NZD", "bias": "NEUTRAL", "probability": { "bull": 0.38, "neutral": 0.36, "bear": 0.26 }, "confidence": "LOW", "rank": 4, "key_drivers": ["RBNZ ambiguous", "NZD/AUD rotation"], "alerts": ["LOW_CONFIDENCE"], "historical_accuracy_12w": 0.64 }
  ],
  "pair_recommendations": {
    "strong_long": [
      { "pair": "USD/JPY", "spread": 0.65, "base_currency": "USD", "quote_currency": "JPY", "confidence": "MEDIUM" },
      { "pair": "GBP/AUD", "spread": 1.4, "base_currency": "GBP", "quote_currency": "AUD", "confidence": "MEDIUM" }
    ],
    "strong_short": [
      { "pair": "AUD/USD", "spread": 0.6, "base_currency": "AUD", "quote_currency": "USD", "confidence": "MEDIUM" }
    ],
    "avoid": [
      { "pair": "EUR/NZD", "spread": 2.0, "base_currency": "EUR", "quote_currency": "NZD", "confidence": "LOW" },
      { "pair": "CHF/NZD", "spread": 1.8, "base_currency": "CHF", "quote_currency": "NZD", "confidence": "LOW" }
    ]
  },
  "weekly_alerts": [
    {
      "type": "EXTREME_POSITIONING",
      "currency": "JPY",
      "message": "JPY net short extreme. COT index near all-time low.",
      "severity": "HIGH",
      "context": { "cot_index": 8, "net_contracts": -83200 }
    },
    {
      "type": "MISSING_DATA",
      "message": "Macro data STALE: Australian CPI not yet published for reference week.",
      "severity": "MEDIUM",
      "context": { "affected_currency": "AUD", "expected_date": "2026-03-09" }
    }
  ]
}
