{
  "meta": {
    "weekLabel": "2026-W19",
    "generatedAt": "2026-05-09T01:38:18.494397+00:00",
    "modelVersion": "rf-v2.1",
    "featureVersion": "v2.1-28f",
    "overallConfidence": "HIGH",
    "dataSourceStatus": {
      "cot": "OK",
      "macro": "OK",
      "cross_asset": "OK",
      "calendar": "OK"
    },
    "pipelineRuntime": 2.77
  },
  "predictions": [
    {
      "currency": "USD",
      "bias": "NEUTRAL",
      "probability": {
        "bull": 0.0761,
        "neutral": 0.8262,
        "bear": 0.0977
      },
      "confidence": "HIGH",
      "rank": 1,
      "key_drivers": [
        "COT positioning",
        "Leveraged funds",
        "Dealer contrarian"
      ],
      "alerts": [
        "EXTREME_POSITIONING"
      ]
    },
    {
      "currency": "AUD",
      "bias": "NEUTRAL",
      "probability": {
        "bull": 0.3973,
        "neutral": 0.5951,
        "bear": 0.0076
      },
      "confidence": "MEDIUM",
      "rank": 2,
      "key_drivers": [
        "CPI differential",
        "COT positioning",
        "Leveraged funds"
      ],
      "alerts": [
        "EXTREME_POSITIONING"
      ]
    },
    {
      "currency": "CAD",
      "bias": "NEUTRAL",
      "probability": {
        "bull": 0.4051,
        "neutral": 0.5876,
        "bear": 0.0073
      },
      "confidence": "MEDIUM",
      "rank": 3,
      "key_drivers": [
        "CPI differential",
        "COT positioning",
        "Net position change"
      ],
      "alerts": []
    },
    {
      "currency": "CHF",
      "bias": "NEUTRAL",
      "probability": {
        "bull": 0.0582,
        "neutral": 0.7931,
        "bear": 0.1487
      },
      "confidence": "HIGH",
      "rank": 4,
      "key_drivers": [
        "CPI differential",
        "Spread vs USD",
        "Dealer contrarian"
      ],
      "alerts": []
    },
    {
      "currency": "EUR",
      "bias": "NEUTRAL",
      "probability": {
        "bull": 0.0694,
        "neutral": 0.8145,
        "bear": 0.1161
      },
      "confidence": "HIGH",
      "rank": 5,
      "key_drivers": [
        "CPI differential",
        "Spread vs USD",
        "Leveraged funds"
      ],
      "alerts": []
    },
    {
      "currency": "GBP",
      "bias": "NEUTRAL",
      "probability": {
        "bull": 0.0581,
        "neutral": 0.7979,
        "bear": 0.1439
      },
      "confidence": "HIGH",
      "rank": 6,
      "key_drivers": [
        "CPI differential",
        "Spread vs USD",
        "Leveraged funds"
      ],
      "alerts": []
    },
    {
      "currency": "NZD",
      "bias": "NEUTRAL",
      "probability": {
        "bull": 0.4245,
        "neutral": 0.5685,
        "bear": 0.007
      },
      "confidence": "MEDIUM",
      "rank": 7,
      "key_drivers": [
        "CPI differential",
        "Spread vs USD",
        "COT 4w momentum"
      ],
      "alerts": []
    },
    {
      "currency": "JPY",
      "bias": "NEUTRAL",
      "probability": {
        "bull": 0.0449,
        "neutral": 0.7975,
        "bear": 0.1576
      },
      "confidence": "HIGH",
      "rank": 8,
      "key_drivers": [
        "CPI differential",
        "Spread vs USD",
        "Leveraged funds"
      ],
      "alerts": [
        "EXTREME_POSITIONING"
      ]
    }
  ],
  "pair_recommendations": {
    "strong_long": [],
    "strong_short": [],
    "avoid": [
      {
        "pair": "AUD/USD",
        "spread": 0.0,
        "base_currency": "AUD",
        "quote_currency": "USD",
        "confidence": "MEDIUM"
      },
      {
        "pair": "AUD/CAD",
        "spread": 0.0,
        "base_currency": "AUD",
        "quote_currency": "CAD",
        "confidence": "MEDIUM"
      },
      {
        "pair": "AUD/CHF",
        "spread": 0.0,
        "base_currency": "AUD",
        "quote_currency": "CHF",
        "confidence": "MEDIUM"
      }
    ]
  },
  "weekly_alerts": [
    {
      "type": "EXTREME_POSITIONING",
      "currency": "AUD",
      "message": "AUD COT index in extreme zone (94.7)",
      "severity": "MEDIUM",
      "context": {
        "cot_index": 94.71
      }
    },
    {
      "type": "EXTREME_POSITIONING",
      "currency": "JPY",
      "message": "JPY COT index in extreme zone (0.0)",
      "severity": "MEDIUM",
      "context": {
        "cot_index": 0.0
      }
    },
    {
      "type": "EXTREME_POSITIONING",
      "currency": "USD",
      "message": "USD COT index in extreme zone (95.4)",
      "severity": "MEDIUM",
      "context": {
        "cot_index": 95.41
      }
    }
  ]
}